{
  "schema_version": "1.0",
  "request": {
    "candidates": [
      {
        "id": "parallel",
        "label": "Parallel Task API",
        "official_domains": [
          "docs.parallel.ai"
        ]
      },
      {
        "id": "serper",
        "label": "Serper Search API",
        "official_domains": [
          "serper.dev"
        ]
      }
    ],
    "criteria": [
      {
        "id": "unit_price",
        "question": "What is the published entry or core tier unit price, with billing basis preserved?"
      },
      {
        "id": "guaranteed_latency",
        "question": "Is an exact guaranteed end-to-end latency published on the inspected pricing page?"
      }
    ],
    "max_age_hours": 24,
    "max_cost_usd": "0.025"
  },
  "cells": [
    {
      "candidate": "parallel",
      "criterion": "unit_price",
      "value": "0.025",
      "unit": "successful core task run",
      "currency": "USD",
      "billing_basis": "25 USD per 1000 successful core Task Runs",
      "scope": {
        "plan": "core",
        "version": null,
        "region": null
      },
      "evidence_status": "supported",
      "sources": [
        {
          "url": "https://docs.parallel.ai/getting-started/pricing",
          "excerpt": "Cost ($/1000) \u2026 core | 25 \u2026 successfully completed runs.",
          "retrieved_at": "2026-09-26T14:08:21Z"
        }
      ],
      "reason": "Calculated as 25 / 1000. A research run is not the same product as a search query; this does not rank service value."
    },
    {
      "candidate": "parallel",
      "criterion": "guaranteed_latency",
      "value": null,
      "unit": null,
      "currency": null,
      "billing_basis": null,
      "scope": {
        "plan": null,
        "version": null,
        "region": null
      },
      "evidence_status": "not_found",
      "sources": [],
      "reason": "No exact guaranteed end-to-end latency established from the inspected pricing page; descriptive timing is not a guarantee."
    },
    {
      "candidate": "serper",
      "criterion": "unit_price",
      "value": "0.001",
      "unit": "search query",
      "currency": "USD",
      "billing_basis": "50 USD prepaid for 50000 queries; credits expire after 6 months; taxes excluded",
      "scope": {
        "plan": "Starter",
        "version": null,
        "region": null
      },
      "evidence_status": "supported",
      "sources": [
        {
          "url": "https://serper.dev/",
          "excerpt": "$50 \u2026 50k credits ($1.00/1k) \u2026 valid for 6 months \u2026 Excluding sales tax/VAT/GST",
          "retrieved_at": "2026-09-26T14:08:21Z"
        }
      ],
      "reason": "Nominal unit cost at full utilisation of prepaid credits. Expired unused credits increase effective cost. Search discovery is not a complete research job."
    },
    {
      "candidate": "serper",
      "criterion": "guaranteed_latency",
      "value": null,
      "unit": null,
      "currency": null,
      "billing_basis": null,
      "scope": {
        "plan": null,
        "version": null,
        "region": null
      },
      "evidence_status": "not_found",
      "sources": [],
      "reason": "No exact guaranteed end-to-end latency established from the inspected pricing page; descriptive timing is not a guarantee."
    }
  ],
  "provenance": {
    "provider": "import",
    "run_id": null,
    "generated_at": "2026-09-26T14:08:21Z",
    "is_demo": false,
    "actual_cost_usd": null,
    "estimated_cost_usd": "0"
  }
}
